{
    "$schema": "http://json-schema.org/draft-04/schema#",
    "id" : "https://raw.githubusercontent.com/common-workflow-language/common-workflow-language/draft-1/schemas/tool.json",
    "description": "Common tool description schema",
    "type": "object",
    "definitions": {
        "expression": {
            "type": "object",
            "required": ["$expr"],
            "properties": {
                "$expr": {
                    "type": "string"
                }
            }
        },
        "template": {
            "type": "object",
            "required": ["$tmpl"],
            "properties": {
                "$tmpl": {
                    "type": "string"
                }
            }
        },
        "strOrExpr": {
            "oneOf": [
                { "type": "string" },
                { "$ref": "#definitions/expression" },
                { "$ref": "#definitions/template" },

                { "$ref": "https://raw.githubusercontent.com/common-workflow-language/common-workflow-language/draft-1/schemas/metaschema.json#definitions/$job" }
            ]
        },
        "numOrExpr": {
            "oneOf": [
                { "type": "number" },
                { "$ref": "#definitions/expression" },
                { "$ref": "https://raw.githubusercontent.com/common-workflow-language/common-workflow-language/draft-1/schemas/metaschema.json#definitions/$job" }
            ]
        },
        "intOrExpr": {
            "oneOf": [
                { "type": "integer" },
                { "$ref": "#definitions/expression" },
                { "$ref": "https://raw.githubusercontent.com/common-workflow-language/common-workflow-language/draft-1/schemas/metaschema.json#definitions/$job" }
            ]
        },
        "boolOrExpr": {
            "oneOf": [
                { "type": "boolean" },
                { "$ref": "#definitions/expression" },
                { "$ref": "https://raw.githubusercontent.com/common-workflow-language/common-workflow-language/draft-1/schemas/metaschema.json#definitions/$job" }
            ]
        }
    },
    "properties": {
        "documentAuthor": {
                    "oneOf": [
                        { "$ref": "https://raw.githubusercontent.com/common-workflow-language/common-workflow-language/draft-1/schemas/metaschema.json#definitions/stringArray" },
                        { "type": "string" }
                    ]
        },
        "documentDescription": { "type": "string" },
        "softwareDescription": { "type": "object" },
        "softwareRelease": { "type": "object" },
        "inputs": { "$ref": "https://raw.githubusercontent.com/common-workflow-language/common-workflow-language/draft-1/schemas/metaschema.json" },
        "outputs": { "$ref": "https://raw.githubusercontent.com/common-workflow-language/common-workflow-language/draft-1/schemas/metaschema.json" },
        "requirements": {
            "type": "object",
            "properties": {
                "platformFeatures": { "$ref": "https://raw.githubusercontent.com/common-workflow-language/common-workflow-language/draft-1/schemas/metaschema.json#definitions/stringArray" },
                "environment": {
                    "type": "object",
                    "properties": {
                        "container": {
                            "type": "object",
                            "properties": {
                                "imageId": { "type": "string" },
                                "type": { "type": "string" },
                                "uri": { "type": "string" }
                            }
                        }
                    }
                },
                "resources": {
                    "type": "object",
                    "properties": {
                        "cpu": { "$ref": "#definitions/intOrExpr" },
                        "diskSpace": { "$ref": "#definitions/intOrExpr" },
                        "mem": { "$ref": "#definitions/intOrExpr" },
                        "network": { "$ref": "#definitions/boolOrExpr" }
                    }
                },
                "templates": {
                    "type":"array",
                    "items": {
                        "type":"object",
                        "properties": {
                            "name": {"$ref": "#definitions/strOrExpr"},
                            "value": {"$ref": "#definitions/strOrExpr"}
                        }
                    }
                }

            }
        },
        "adapter": {
            "type": "object",
            "properties": {
                "args": {
                    "type": "array",
                    "items": {
                        "type": "object",
                        "properties": {
                            "prefix": { "type": "string" },
                            "order": { "type": "integer" },
                            "separator": { "type": "string" },
                            "itemSeparator": { "type": "string" },
                            "value": { "$ref": "#definitions/strOrExpr" }
                        }
                    }
                },
                "baseCmd": {
                    "oneOf": [
                        {
                            "type": "array",
                            "items": {
                                "oneOf": [
                                    {"type": "string"},
                                    {"$ref": "#definitions/expression"},
                                    {"$ref": "#definitions/template"}
                                ]
                            },
                            "minItems": 1,
                            "uniqueItems": false
                        },
                        { "type": "string" },
                        { "$ref": "#definitions/expression" },
                        { "$ref": "#definitions/template" }
                    ]
                },
                "stdout": { "$ref": "#definitions/strOrExpr" },
                "stdin": { "$ref": "#definitions/strOrExpr" }
            }
        }
    }
}
