{
    "documentAuthor": ["peter.amstutz@curoverse.com"],
    "documentDescription": "Sort the contents of a file to stdout using 'sort' running in a docker container.",
    "requirements": {
        "environment": {
            "container": {
                "type": "docker",
                "imageId": "arvados/jobs"
            }
        }
    },
    "inputs": {
        "type": "object",
        "required": [ "file1" ],
        "properties": {
            "file1": {
                "type": "file",
                "adapter": {
                    "order": 1
                }
            }
        }
    },
    "adapter": {
        "baseCmd": "sort",
        "stdout":"sorted.txt"
    }
}
