{
    "documentAuthor": ["peter.amstutz@curoverse.com"],
    "documentDescription": "Copy the contents of a file by piping it into stdin of 'cat' and redirecting to 'output.txt' running in a docker container.",
    "requirements": {
        "environment": {
            "container": {
                "type": "docker",
                "imageId": "arvados/jobs"
            }
        }
    },
    "inputs": {
        "type": "object",
        "required": [ "file1" ],
        "properties": {
            "file1": {
                "type": "file"
            }
        }
    },
    "outputs": {
        "type": "object",
        "required": [ "output" ],
        "properties":{
            "output": {
                "adapter": {
                    "glob":"output.txt"
                }
            }
        }
    },
    "adapter": {
        "baseCmd": "cat",
        "stdin": {"$job": "#inputs/file1/path"},
        "stdout": "output.txt"
    }
}
